{
  "as_of": "(sample data)",
  "data_source": "illustrative sample",
  "headline": "Of your 6 funds: 1 doing well, 2 on track, 1 worth a closer look, 1 needing attention, 1 with limited data.",
  "counts": {
    "Doing well": 1,
    "On track": 2,
    "Worth a closer look": 1,
    "Needs attention": 1,
    "Limited data": 1,
    "Not enough data": 0
  },
  "cards": [
    {
      "topic": "returns",
      "title": "Returns",
      "status": "watch",
      "one_liner": "4 of 5 funds look fine here; 1 worth a closer look. (1 not covered by this check.)",
      "sections": [
        {
          "topic": "returns",
          "title": "Growth over 1, 3 and 5 years",
          "what": "How fast your money grew each year on average, compared with the market index.",
          "insights": [
            {
              "id": "returns-sample-flexi-cap-fund-a",
              "topic": "returns",
              "status": "good",
              "headline": "Ahead of its benchmark",
              "sentence": "Over 5 years this fund grew 17.1% a year; the Sample 500 index grew 14.6%. That is 2.5% a year ahead.",
              "fund": "Sample Flexi Cap Fund A",
              "suggestion": null,
              "jargon_term": "cagr",
              "numbers": {
                "horizon_years": 5,
                "fund_cagr": 17.1,
                "bench_cagr": 14.6,
                "gap_pts": 2.5,
                "fund_value": 220183,
                "bench_value": 197662,
                "by_horizon": [
                  {
                    "years": 1,
                    "fund": 21.0,
                    "bench": 17.5,
                    "gap": 3.5
                  },
                  {
                    "years": 3,
                    "fund": 18.4,
                    "bench": 15.2,
                    "gap": 3.2
                  },
                  {
                    "years": 5,
                    "fund": 17.1,
                    "bench": 14.6,
                    "gap": 2.5
                  }
                ]
              }
            },
            {
              "id": "returns-sample-mid-cap-fund-b",
              "topic": "returns",
              "status": "ok",
              "headline": "Roughly in line with its benchmark",
              "sentence": "Over 5 years this fund grew 22.5% a year; the Sample Midcap index grew 23.1%. That is about the same.",
              "fund": "Sample Mid Cap Fund B",
              "suggestion": null,
              "jargon_term": "cagr",
              "numbers": {
                "horizon_years": 5,
                "fund_cagr": 22.5,
                "bench_cagr": 23.1,
                "gap_pts": -0.6,
                "fund_value": 275855,
                "bench_value": 282677,
                "by_horizon": [
                  {
                    "years": 1,
                    "fund": 24.0,
                    "bench": 25.0,
                    "gap": -1.0
                  },
                  {
                    "years": 3,
                    "fund": 22.9,
                    "bench": 24.0,
                    "gap": -1.1
                  },
                  {
                    "years": 5,
                    "fund": 22.5,
                    "bench": 23.1,
                    "gap": -0.6
                  }
                ]
              }
            },
            {
              "id": "returns-sample-large---mid-cap-fund-c",
              "topic": "returns",
              "status": "attention",
              "headline": "Well behind its benchmark",
              "sentence": "Over 5 years this fund grew 11.8% a year; the Sample LargeMidcap index grew 15.4%. That is 3.6% a year behind.",
              "fund": "Sample Large & Mid Cap Fund C",
              "suggestion": "Worth asking whether this is a rough patch for the fund's style or a lasting gap, and how its closest peers did over the same period.",
              "jargon_term": "cagr",
              "numbers": {
                "horizon_years": 5,
                "fund_cagr": 11.8,
                "bench_cagr": 15.4,
                "gap_pts": -3.6,
                "fund_value": 174666,
                "bench_value": 204658,
                "by_horizon": [
                  {
                    "years": 1,
                    "fund": 14.0,
                    "bench": 18.0,
                    "gap": -4.0
                  },
                  {
                    "years": 3,
                    "fund": 12.1,
                    "bench": 16.0,
                    "gap": -3.9
                  },
                  {
                    "years": 5,
                    "fund": 11.8,
                    "bench": 15.4,
                    "gap": -3.6
                  }
                ]
              }
            },
            {
              "id": "returns-sample-large-cap-index-fund-d",
              "topic": "returns",
              "status": "ok",
              "headline": "Tracking its index closely",
              "sentence": "This fund copies the Sample 50 index. Over 5 years it returned 13.4% a year against 13.6% for the index, a gap of 0.2%. That is normal for an index fund.",
              "fund": "Sample Large Cap Index Fund D",
              "suggestion": null,
              "jargon_term": "tracking",
              "numbers": {
                "horizon_years": 5,
                "fund_cagr": 13.4,
                "bench_cagr": 13.6,
                "gap_pts": -0.2,
                "fund_value": 187528,
                "bench_value": 189187,
                "by_horizon": [
                  {
                    "years": 1,
                    "fund": 12.9,
                    "bench": 13.1,
                    "gap": -0.2
                  },
                  {
                    "years": 3,
                    "fund": 13.6,
                    "bench": 13.8,
                    "gap": -0.2
                  },
                  {
                    "years": 5,
                    "fund": 13.4,
                    "bench": 13.6,
                    "gap": -0.2
                  }
                ]
              }
            },
            {
              "id": "returns-sample-thematic-fund-e",
              "topic": "returns",
              "status": "ok",
              "headline": "Ahead of its benchmark",
              "sentence": "Over the last year this fund returned 28.0%; the Sample 500 index returned 17.5%. That is 10.5 percentage points ahead. One year is a short time to judge a fund, so treat this lightly.",
              "fund": "Sample Thematic Fund E",
              "suggestion": null,
              "jargon_term": "cagr",
              "numbers": {
                "horizon_years": 1,
                "fund_cagr": 28.0,
                "bench_cagr": 17.5,
                "gap_pts": 10.5,
                "fund_value": 128000,
                "bench_value": 117500,
                "by_horizon": [
                  {
                    "years": 1,
                    "fund": 28.0,
                    "bench": 17.5,
                    "gap": 10.5
                  }
                ]
              }
            }
          ]
        },
        {
          "topic": "calendar",
          "title": "Year by year",
          "what": "How the fund did in each calendar year, and by how much it finished ahead of or behind the benchmark (its alpha).",
          "insights": [
            {
              "id": "calendar-sample-flexi-cap-fund-a",
              "topic": "calendar",
              "status": "good",
              "headline": "Beat its benchmark in most years, by a clear margin",
              "sentence": "In every one of the last 5 calendar years this fund beat the Sample 500 index. On average it finished 3.0 percentage points ahead of the benchmark each year (its margin over the benchmark, often called alpha). The widest gap was +5.0 points in 2024; the narrowest was +2.2 points in 2022.",
              "fund": "Sample Flexi Cap Fund A",
              "suggestion": null,
              "jargon_term": "calendar",
              "numbers": {
                "years": [
                  2021,
                  2022,
                  2023,
                  2024,
                  2025
                ],
                "fund": [
                  34.0,
                  6.5,
                  29.8,
                  21.2,
                  12.4
                ],
                "bench": [
                  31.6,
                  4.3,
                  26.9,
                  16.2,
                  9.9
                ],
                "alpha": [
                  2.4,
                  2.2,
                  2.9,
                  5.0,
                  2.5
                ],
                "avg_alpha": 3.0,
                "beats": 5,
                "n": 5,
                "best_alpha_year": 2024,
                "worst_alpha_year": 2022
              }
            },
            {
              "id": "calendar-sample-mid-cap-fund-b",
              "topic": "calendar",
              "status": "ok",
              "headline": "Roughly level with its benchmark year by year",
              "sentence": "In 3 of the last 5 calendar years this fund beat the Sample Midcap index. On average it finished 0.4 percentage points behind the benchmark each year (its margin over the benchmark, often called alpha). The widest gap was +0.9 points in 2025; the narrowest was −2.6 points in 2023.",
              "fund": "Sample Mid Cap Fund B",
              "suggestion": null,
              "jargon_term": "calendar",
              "numbers": {
                "years": [
                  2021,
                  2022,
                  2023,
                  2024,
                  2025
                ],
                "fund": [
                  44.0,
                  3.1,
                  41.5,
                  26.0,
                  6.0
                ],
                "bench": [